{
  "sketch_version": 1,
  "frame": {
    "visual_id": "vis_00000000000000000000000000",
    "x_min": 0,
    "x_max": 0,
    "y_min": 0,
    "y_max": 0
  },
  "elements": [
    {
      "kind": "line",
      "from": [
        0,
        0
      ],
      "to": [
        0,
        0
      ]
    }
  ],
  "checks": []
}
